product_name,product_link,product_img
Kaos Polos Premium Cotton Combed 30s,https://shopee.co.id/product/123456789,https://cf.shopee.co.id/file/abc123/image.jpg
Celana Chinos Panjang Pria,https://shopee.co.id/product/987654321,https://cf.shopee.co.id/file/def456/image.jpg
Jaket Hoodie Polos Oversize,https://shopee.co.id/product/456789123,"https://cf.shopee.co.id/file/ghi789/image1.jpg, https://cf.shopee.co.id/file/ghi790/image2.jpg, https://cf.shopee.co.id/file/ghi791/image3.jpg"
Kemeja Flannel Pria Lengan Panjang,https://shopee.co.id/product/789123456,https://cf.shopee.co.id/file/jkl012/image.jpg
Sneakers Casual Pria Import,https://shopee.co.id/product/321654987,"https://cf.shopee.co.id/file/mno345/image1.jpg, https://cf.shopee.co.id/file/mno346/image2.jpg"
